"","Web.URL","Snippet","Lead.Paragraph","Abstract","Publish.Date","Doc.Type","Material.Type","id","Word.Count","Headline.Main","Headline.Kicker","URI","Content.Kicker","Print.Headline","Headline.Name","SEO","Headline.Sub"
"217","https://www.nytimes.com/2015/12/07/nyregion/in-scotland-unlike-america-mass-shooting-led-to-stricter-gun-laws.html","The outcry that greeted the killing of 16 children in Dunblane, Scotland, in 1996, spurred the British government to act in a way that has been a boon to public safety and a salve to collective grief....","The outcry that greeted the killing of 16 children in Dunblane, Scotland, in 1996, spurred the British government to act in a way that has been a boon to public safety and a salve to collective grief.","Britain's move to severely restrict access to guns after 1996 mass shooting at Dunblane, Scotland primary school contrasts sharply with United States government's inaction amid surge in gun massacres; grief still lingers in Scotland, where residents and law enforcement agree tighter gun control has made them safer.","2015-12-08T00:00:00Z","article","News","5663150038f0d87104c915ee",1480,"In Scotland, Unlike America, Mass Shooting Led to Stricter Gun Laws",NA,NA,NA,"In Scotland, Unlike America, a Mass Shooting Led to Stricter Gun Laws",NA,NA,NA
"218","https://www.nytimes.com/2015/12/11/opinion/gunmakers-war-profiteering-on-the-home-front.html","The nation needs restoration of a federal assault weapons ban — this time minus the loopholes the gun industry exploited to boost sales....","The nation needs restoration of a federal assault weapons ban — this time minus the loopholes the gun industry exploited to boost sales.","Editorial contends gun industry's marketing of high-powered military weapons to civilians amounts to war profiteering; holds industry plays on public fears to sell people same weapons used in mass shootings that stoke panic; calls for restoration of federal assault weapons ban allowed to lapse in 2004 through lawmakers' obeisance to gun industry, and for closing of additional loopholes.","2015-12-11T00:00:00Z","article","Editorial","566a877b38f0d857ec8b0a5c",608,"Gunmakers’ War Profiteering on the Home Front","Editorial",NA,"Editorial","War Profiteering on the Home Front",NA,NA,NA
"219","https://www.nytimes.com/2015/12/11/us/how-to-stop-mass-shootings-in-america-times-readers-respond.html","Times readers responded: What can be done, if anything, to prevent mass shootings?...","Times readers responded: What can be done, if anything, to prevent mass shootings?",NA,"2015-12-11T00:00:00Z","article","News","5669d23a38f0d857ec8b0878",1090,"How to Stop Mass Shootings in America: Times Readers Respond",NA,NA,NA,NA,NA,NA,NA
"220","https://www.nytimes.com/2015/12/13/us/gun-advocates-demonstrate-outside-university-of-texas-campus.html","It was a highly publicized but divisive demonstration that was staged in favor of ending gun-free zones on campuses....","It was a highly publicized but divisive demonstration that was staged in favor of ending gun-free zones on campuses.","Demonstrators gather at University of Texas at Austin for Life and Liberty Walk to End Gun Free Zone, divisive protest that involved mock shooting; group, that was outnumbered by press and counter-demonstrators, hopes to establish right to carry guns on campus, saying it will help to combat mass shootings. ","2015-12-13T00:00:00Z","article","News","566c7e9038f0d82b1b4d7356",993,"Groups Converge for Mock Shooting Near University of Texas",NA,NA,NA,"Groups Converge for Mock Shooting",NA,NA,NA
"221","https://www.nytimes.com/2015/12/16/opinion/dont-blame-mental-illness-for-gun-violence.html","Effectively treating mental illness should be a priority in America, but it won’t resolve the gun violence public health crisis....","Effectively treating mental illness should be a priority in America, but it won’t resolve the gun violence public health crisis.","Editorial challenges gun-control critics who advocate improved care for mentally ill people over tougher gun restrictions as strategy for curbing mass shootings; cites studies suggesting approach would have negligible effect on reducing gun violence; calls on states to enforce laws already in place to restrict mentally ill people's access to guns.","2015-12-16T00:00:00Z","article","Editorial","5670cd1f38f0d803bb110cc0",693,"Don’t Blame Mental Illness for Gun Violence","Editorial",NA,"Editorial","Mental Illness and Gun Violence   ",NA,NA,NA
"222","https://www.nytimes.com/politics/first-draft/2015/12/17/poll-watch-americans-fear-more-terrorist-attacks-but-have-mixed-views-on-gun-control/","Most people in the United States describe themselves as very concerned about the threat of terrorism, but considerably fewer worry about a mass shooting taking place where they live, according to a New York Times/CBS News poll....",NA,"Most people in the United States describe themselves as very concerned about the threat of terrorism, but considerably fewer worry about a mass shooting taking place where they live, according to a New York Times/CBS News poll.","2015-12-17T06:00:56Z","blogpost","Blog","5672967a38f0d82eed76c5c7",710,"Poll Watch: Americans Fear More Terrorist Attacks but Have Mixed Views on Gun Control","First Draft",NA,NA,NA,NA,NA,NA
"223","https://www.nytimes.com/2015/12/20/opinion/sunday/the-deer-in-my-sights.html","The doe stood no more than 30 feet away. It would be a clean shot....","The doe stood no more than 30 feet away. It would be a clean shot.","Op-Ed article by Seamus McGraw describes making decision not to shoot deer on recent hunt, citing lack of clear conscience; expresses anger at those who continue to oppose any reasonable gun control in wake of series of mass shootings.","2015-12-20T00:00:00Z","article","Op-Ed","5675b05538f0d82604f36320",774,"The Deer in My Sights","Opinion",NA,"Opinion","The Deer in My Sights",NA,NA,NA
"224","https://www.nytimes.com/2015/12/20/opinion/for-grieving-families-each-gun-massacre-echoes-the-last.html","While the Newtown survivors know that full recovery is impossible, they seek strength in community cohesion....","While the Newtown survivors know that full recovery is impossible, they seek strength in community cohesion.","Francis X Clines Editorial Observer underscores how mass shooting in San Bernardino, Calif, has compounded grief of families of victims of massacre at Sandy Hook Elementary School; details efforts some of those families have made to push for stricter gun control laws, and backlash they have faced for doing so.","2015-12-20T00:00:00Z","article","Editorial","5675b04138f0d82604f36318",534,"For Grieving Families, Each Gun Massacre Echoes the Last","Editorial Observer",NA,"Editorial Observer","For Families, Each Massacre Echoes the Last<br /><br />",NA,NA,NA
"225","https://www.nytimes.com/2015/12/21/us/politics/respite-in-hawaii-for-president-obama-but-reality-is-never-far-away.html","President Obama&#8217;s two-week holiday vacation, an eagerly anticipated chance to relax before a final year in office, began with a difficult task in San Bernardino, Calif....","President Obama&#8217;s two-week holiday vacation, an eagerly anticipated chance to relax before a final year in office, began with a difficult task in San Bernardino, Calif.","White House Letter; Pres Obama meets with families of victims of San Bernardino, Calif mass shooting on eve of his family's annual holiday vacation in Hawaii; task highlights difficulty of balancing president's need for respite with his job's incessant demands.","2015-12-21T00:00:00Z","article","News","56775fa838f0d80a0f1da750",916,"Relishing a Respite in Hawaii, but Reality Is Never Far Away ",NA,NA,"White House Letter","Relishing a Respite in Hawaii, but Reality Is Never Far Away ",NA,NA,NA
"226","https://learning.blogs.nytimes.com/2016/01/06/news-qs-tearful-obama-announcing-gun-control-steps-condemns-shootings/","What new executive actions intended to reduce the number of mass shootings, suicides and killings, did President Obama announce?...",NA,"What new executive actions intended to reduce the number of mass shootings, suicides and killings, did President Obama announce?","2016-01-06T04:52:43Z","blogpost","Blog","568ce51038f0d803f4a0c694",395,"News Q&#8217;s | Tearful Obama, Announcing Gun Control Steps, Condemns Shootings","The Learning Network",NA,NA,NA,NA,NA,NA
"227","https://www.nytimes.com/2016/01/06/us/gun-control-measures-meet-with-skepticism-in-san-bernardino.html","Opinions on President Obama’s plan to expand background checks run the gamut in the city, but many residents seem to agree that it will do little to stop mass shootings....","Opinions on President Obama’s plan to expand background checks run the gamut in the city, but many residents seem to agree that it will do little to stop mass shootings.","Many residents of San Bernardino, Calif, say Pres Obama's plan to expand background checks and law enforcement for some gun sales would not do much to stop mass shootings like December assault that killed 14 people in their city. ","2016-01-06T00:00:00Z","article","News","568c72d638f0d803f4a0c595",985,"To San Bernardino, Obama’s Gun Plan Goes Too Far or Falls Short",NA,NA,NA,"Skepticism Prevails in San Bernardino After President&#8217;s Announcement",NA,NA,NA
"228","https://www.nytimes.com/2016/01/07/us/florida-professor-who-cast-doubt-on-mass-shootings-is-fired.html","James F. Tracy suggested that the 2012 massacre of children at Sandy Hook Elementary and other mass shootings were a hoax designed by the Obama administration....","James F. Tracy suggested that the 2012 massacre of children at Sandy Hook Elementary and other mass shootings were a hoax designed by the Obama administration.","James F Tracy, Florida Atlantic University professor who has espoused conspiracy theories about Obama administration, is fired from his job; Tracy has put forth claims that mass shootings at Sandy Hook Elementary in Connecticut and elsewhere were hoaxes staged by government.","2016-01-07T00:00:00Z","article","News","568dc45138f0d82b2249c508",714,"Florida Professor Who Cast Doubt on Mass Shootings Is Fired",NA,NA,NA,"Professor Who Cast Doubt on Mass Shootings Is Fired",NA,NA,NA
"229","https://www.nytimes.com/2016/01/14/us/chilling-messages-in-journal-of-louisiana-theater-shooter.html","John R. Houser, who had a history of mental illness, denigrated women, blacks and gay people in the journal he kept before killing two people and himself in July....","John R. Houser, who had a history of mental illness, denigrated women, blacks and gay people in the journal he kept before killing two people and himself in July.","Journal left behind by John R Houser, who carried out mass shooting at Lafayette, La, movie theater in July 2015, contains chilling references to violence, South Carolina mass shooter Dylann Roof and invective against women, blacks, gays and news media.","2016-01-14T00:00:00Z","article","News","5696fba238f0d865e6c3498d",430,"Chilling Messages in Journal of Louisiana Theater Shooter",NA,NA,NA,"Chilling Messages in Journal of Louisiana Theater Shooter",NA,NA,NA
"230","https://www.nytimes.com/2016/01/21/movies/the-sundance-film-festival-trains-its-sights-on-the-gun-debate.html","Several selections at this year’s festival are joining the national discussion about mass shootings and gun control....","Several selections at this year’s festival are joining the national discussion about mass shootings and gun control.","Gun violence is theme to many documentaries screening at Sundance Film Festival in Park City, Utah; filmmakers, galvanized from spate of mass shootings in Newtown, Aurora and other American cities, hope movies at heavily publicized event will lead to effective solution to heartbreaking issue.","2016-01-21T00:00:00Z","article","News","56a00ac538f0d80627b20b4c",1170,"The Sundance Film Festival Trains Its Sights on the Gun Debate",NA,NA,NA,"Sundance Festival Trains Its Sights on Gun Debate",NA,NA,NA
"231","https://www.nytimes.com/2016/01/27/us/suspect-is-charged-in-milwaukee-with-planning-a-mass-shooting.html","The suspect, Samy Mohamed Hamzeh, 23, was charged with illegally buying a machine gun and a silencer to carry out the attack at a Masonic temple in the city....","The suspect, Samy Mohamed Hamzeh, 23, was charged with illegally buying a machine gun and a silencer to carry out the attack at a Masonic temple in the city.","Federal prosecutors say they have arrested Milwaukee man Samy Mohamed Hamzeh, who is charged with illegally buying machine gun in connection with apparent plans for mass shooting at Masonic temple in city; investigators say Hamzeh has not been charged with terrorism but that investigation is ongoing. ","2016-01-27T00:00:00Z","article","News","56a817e438f0d85239f493a0",278,"Suspect Is Charged in Milwaukee With Planning a Mass Shooting",NA,NA,NA,"Wisconsin Man Charged With Plotting Mass Shooting ",NA,NA,NA
"232","https://www.nytimes.com/2016/01/27/us/some-sheriffs-bristle-at-recall-of-military-equipment.html","A federal order will deprive local authorities of critical tools in an age of heightened fears about terrorism and mass shootings, some law enforcement leaders say....","A federal order will deprive local authorities of critical tools in an age of heightened fears about terrorism and mass shootings, some law enforcement leaders say.","Obama administration's order that law enforcement agencies across United States return surplus military equipment to federal government by April 1 has prompted complaints from some agencies; supporters of plan say equipment is unnecessary and can fuel police use of excessive force, while detractors hold military equipment helps officers in changed and increasingly violent world.","2016-01-27T00:00:00Z","article","News","56a7fd9138f0d85239f4936d",1255,"Some Officers Bristle at Recall of Military Equipment",NA,NA,NA,"U.S. Taking Back Military Gear From Local Law Enforcement ",NA,NA,NA
"233","https://www.nytimes.com/2016/02/24/technology/justice-department-wants-apple-to-unlock-nine-more-iphones.html","The disclosure seems to bolster the company’s position that cooperating with prosecutors in a California mass shooting case could have a wider effect....","The disclosure seems to bolster the company’s position that cooperating with prosecutors in a California mass shooting case could have a wider effect.","Justice Dept is demanding Apple's assistance in unlocking at least nine iPhones nationwide in addition to phone used by San Bernardino gunman, citing 1789 law; Apple is battling government's demands in at least seven of other nine cases.","2016-02-24T00:00:00Z","article","News","56cd0d2138f0d838c6ea4bc5",849,"Apple Faces U.S. Demand to Unlock 9 More iPhones",NA,NA,NA,"Justice Dept. Wants Apple to Unlock More Phones  ",NA,NA,NA
"234","https://www.nytimes.com/2016/02/27/us/kansas-shooting-cedric-larry-ford.html","As the authorities piece together what led Cedric Larry Ford to fatally shoot three colleagues and injure 14 more, the latest in a string of mass shootings, contradictory pictures of him have emerged....","As the authorities piece together what led Cedric Larry Ford to fatally shoot three colleagues and injure 14 more, the latest in a string of mass shootings, contradictory pictures of him have emerged.","Starkly contrasting descriptions of Cedric Ford have emerged as police try to determine why he went on shooting spree at Excel Industries plant in Hesston, Kan, leaving three dead and 14 injured; co-workers describe Ford as quiet and affable, whereas former girlfriend has described him as depressed alcoholic in need of psychological help.","2016-02-27T00:00:00Z","article","News","56d063db38f0d80b98a14e58",1513,"In Kansas, Pop-Pop-Pop, Then Terror: ‘We Got to Go’",NA,NA,NA,"Kansas Gunman Was Warned by Court Just Before Attack",NA,NA,NA
"235","https://www.nytimes.com/2016/02/27/technology/a-brief-explanation-of-apples-showdown-with-the-us-government.html","A summary of the latest developments in the battle between Apple and the F.B.I. over unlocking an iPhone used by one of the attackers in the mass shooting in San Bernardino, Calif....","A summary of the latest developments in the battle between Apple and the F.B.I. over unlocking an iPhone used by one of the attackers in the mass shooting in San Bernardino, Calif.",NA,"2016-02-27T00:00:00Z","article","News","56d0304338f0d80b98a14dbd",479,"A Brief Explanation of Apple’s Showdown With the U.S. Government",NA,NA,NA,NA,NA,NA,NA
"236","https://www.nytimes.com/2016/03/16/technology/apple-court-filing-iphone-case.html","The company said a ruling on unlocking the phone of a gunman in a mass shooting had to take into account the national debate over data privacy....","The company said a ruling on unlocking the phone of a gunman in a mass shooting had to take into account the national debate over data privacy.","Apple files new legal brief underscoring its opposition to court order that requires it to unlock iPhone used by one of attackers involved in San Bernardino, Calif, terrorist attack; Justice Dept criticizes company over brief and its resistance to court order.","2016-03-16T00:00:00Z","article","News","56e88b1638f0d85c820e63f1",869,"Apple and Justice Dept. Trade Barbs in iPhone Privacy Case",NA,NA,NA,"Justice Dept. and Apple Trade Barbs Over Law",NA,NA,NA
"237","https://www.nytimes.com/2016/03/22/technology/apple-fbi-hearing-unlock-iphone.html","A court hearing set for Tuesday was canceled in the Justice Department’s bid to gain access to phone data in the San Bernardino mass shooting inquiry....","A court hearing set for Tuesday was canceled in the Justice Department’s bid to gain access to phone data in the San Bernardino mass shooting inquiry.","Justice Dept says that it will attempt to open iPhone used by gunman Syed Rizwan Farook in San Bernardino, Calif, terrorist attack without assistance from Apple; latest court filing reveals outside party might be able to possibly unlock phone instead, move that could provide at least temporary reprieve from looming clash with Apple in debate over privacy and security. ","2016-03-22T00:00:00Z","article","News","56f07cf438f0d82d2a6d5ddb",986,"U.S. Says It May Not Need Apple’s Help to Unlock iPhone",NA,NA,NA,"U.S. Will Try to Open Phone Without Apple",NA,NA,NA
"238","https://www.nytimes.com/2016/04/16/business/in-new-filing-apple-resists-fbis-call-to-open-iphone-in-drug-case.html","The dispute began two months ago when the federal agency sought Apple’s help to gain access to a phone used by an attacker in a mass shooting....","The dispute began two months ago when the federal agency sought Apple’s help to gain access to a phone used by an attacker in a mass shooting.","Apple, in new filing in Federal District in New York, again resists request from FBI to help unlock iPhone used by Brooklyn drug dealer; company's attorneys say case would lead to flood of similar demands. ","2016-04-16T01:40:23Z","article","News","5711980a38f0d86b7a1cd238",348,"In New Filing, Apple Resists F.B.I.’s Call to Open iPhone in Drug Case",NA,NA,NA,"Apple Again Resists Call  to Help in New York Case",NA,NA,NA
"239","https://www.nytimes.com/2016/04/14/movies/a-documentary-growswith-each-mass-shooting.html","“Speaking Is Difficult,” currently under 15 minutes long, pairs recent footage of sites of gun violence in the U.S. with 911 calls at the time....","“Speaking Is Difficult,” currently under 15 minutes long, pairs recent footage of sites of gun violence in the U.S. with 911 calls at the time.","Director A J Schnack juxtaposes images from locations of mass shootings with recordings of corresponding 911 calls in documentary short Speaking Is Difficult, part of online series Field of Vision; plans to add material after any future shootings with aim of opening new avenues of conversation on issue.","2016-04-16T00:00:00Z","article","News","570e7c3338f0d827bc125d39",994,"A Documentary Grows With Each Mass Shooting",NA,NA,NA,"Evolving Film Chronicles Gun Violence",NA,NA,NA
"240","https://www.nytimes.com/2016/05/09/technology/police-and-tech-giants-wrangle-over-encryption-on-capitol-hill.html","Behind-the-scenes lobbying heightens in this next phase of a divide over digital security that erupted when Apple refused to help unlock an iPhone used in a mass shooting....","Behind-the-scenes lobbying heightens in this next phase of a divide over digital security that erupted when Apple refused to help unlock an iPhone used in a mass shooting.","Growing number of meetings between lawmakers in Washington and law enforcement officials like Manhattan Dist Atty Cyrus R Vance Jr, as well as with technology executives, indicate how issue of smartphone encryption has broadened; both sides are increasingly lobbying lawmakers to influence forthcoming encryption bill.","2016-05-09T00:00:00Z","article","News","572fd76038f0d80c20d0e015",1157,"Police and Tech Giants Wrangle Over Encryption on Capitol Hill",NA,NA,NA,"A Tug of War Over Data Security  Intensifies in the Nation’s Capital",NA,NA,NA
"241","https://www.nytimes.com/2016/05/23/us/americas-overlooked-gun-violence.html","Most shootings with four deaths or injuries are invisible outside their communities. And most of the lives they scar are black....","Most shootings with four deaths or injuries are invisible outside their communities. And most of the lives they scar are black.","At least 358 shootings nationwide in 2015 involved four or more people, leaving 462 dead and 1,330 wounded; near-daily incidents, which were not widely reported as some mass shootings have been, involved mostly black victims, survivors and attackers in poor neighborhoods (Series: The Daily Toll).","2016-05-22T20:31:46+0000","article","News","5742173f38f0d87318c4769d",4450,"A Drumbeat of Multiple Shootings, but America Isn’t Listening","The Daily Toll",NA,"The Daily Toll","Unending but Unheard, the Echo of Gun Violence",NA,NA,NA
"242","https://www.nytimes.com/2016/05/26/opinion/the-shock-of-ordinary-gun-violence.html","Many shootings last year with multiple casualties were sparked by minor, often drunken grievances — forgettable if guns had not been at hand....","Many shootings last year with multiple casualties were sparked by minor, often drunken grievances — forgettable if guns had not been at hand.","Editorial laments lack of attention given to gun violence outside of few highly publicized mass shootings; argues deaths of thousands of Americans annually is public health crisis presidential candidates should be debating; contrasts Hillary Clinton's consistent proposals with Donald J Trumps vacillations on issue. ","2016-05-26T00:00:00Z","article","Editorial","5746a3ef38f0d8433975104b",479,"The Shock of Ordinary Gun Violence","Editorial",NA,"Editorial","The Shock of Ordinary Gun Violence",NA,NA,NA
"243","https://www.nytimes.com/interactive/2016/06/12/us/why-the-orlando-shooting-was-so-deadly.html","The mass shooting at an Orlando nightclub early Sunday was the deadliest in United States history. One out of every three people at the crowded Pulse nightclub was killed or injured....","The mass shooting at an Orlando nightclub early Sunday was the deadliest in United States history. One out of every three people at the crowded Pulse nightclub was killed or injured.",NA,"2016-06-12T00:00:00Z","multimedia","Interactive Feature","575e144738f0d846c1eadbe1",NA,"Why the Orlando Shooting Was So Deadly",NA,NA,NA,NA,NA,NA,NA
"244","https://www.nytimes.com/2016/06/13/us/orlando-gunman-used-assault-rifle-with-military-roots-police-say.html","The police said the nightclub gunman carried a Sig Sauer MCX assault rifle, the civilian version of a weapon widely used in military service....","The police said the nightclub gunman carried a Sig Sauer MCX assault rifle, the civilian version of a weapon widely used in military service.","Assault weapon used by Omar Mateen in Orlando nightclub massacre is variant of highly common AR-15 assault rifle, and descendant of Vietnam-era M-16; weapon, popular with gun enthusiasts and typically capable of semiautomatic or automatic fire, was used in other recent mass shootings; diagram and timeline illustrate sequence of events leading to purchase of guns used by Mateen in Orlando.  ","2016-06-12T21:31:01+0000","article","News","575dd49738f0d846c1eadb6e",517,"Orlando Gunman Used Assault Rifle With Military Roots, Police Say",NA,NA,NA,"Man Used Assault Rifle With Military Roots",NA,NA,NA
"245","https://www.nytimes.com/2016/06/13/us/orlando-attack-roils-gay-community.html","Gay Americans, and those working to advance their rights, spent Sunday grappling with the implications of the mass shooting at a gay nightclub....","Gay Americans, and those working to advance their rights, spent Sunday grappling with the implications of the mass shooting at a gay nightclub.","Shooting massacre at Pulse nightclub in Orlando, Fla, shocks gays and their allies across nation; gay rights leaders say they sense violence and hate crimes are increasing, even as movement makes intermittent gains; many in gay community express fear and anxiety for future. ","2016-06-12T00:00:00Z","article","News","575e3bab38f0d846c1eadc51",1152,"Orlando Attack Roils Gay Community, Painfully Accustomed to Violence",NA,NA,NA,"For Gays Across America, a Massacre Punctuates Fitful Gains",NA,NA,NA
"246","https://learning.blogs.nytimes.com/2016/06/13/news-qs-terror-attack-in-orlando-is-worst-mass-shooting-in-u-s-history/","What will be the repercussions from the deadliest mass shooting in U.S. history?...",NA,"What will be the repercussions from the deadliest mass shooting in U.S. history?","2016-06-13T08:45:49Z","blogpost","Blog","575e72f638f0d846c1eadcd6",2215,"Teaching and Learning Resources | The Attack in Orlando","The Learning Network",NA,NA,NA,NA,NA,NA
