"","Web.URL","Snippet","Lead.Paragraph","Abstract","Publish.Date","Doc.Type","Material.Type","id","Word.Count","Headline.Main","Headline.Kicker","URI","Content.Kicker","Print.Headline","Headline.Name","SEO","Headline.Sub"
"41","https://query.nytimes.com/gst/fullpage.html?res=9D04EEDE1630F933A05754C0A9649D8B63","Going into the weekend, the research firm NRG told film studios that about 20 percent of moviegoers remained hesitant to go to the movies following the July 20 mass shooting in Colorado during ''The Dark Knight Rises.'' Studios also worried about ...","Going into the weekend, the research firm NRG told film studios that about 20 percent of moviegoers remained hesitant to go to the movies following the July 20 mass shooting in Colorado during ''The Dark Knight Rises.'' Studios also worried about competition from the London Olympics and poor weather in parts of the country. Something sure dragged down box office results: North American theaters sold about $135 million in tickets over the weekend, a 25 percent decline from the same period last year, according to studio distribution executives. ''The Dark Knight Rises'' (Warner Brothers) was No. 1, taking in an estimated $64 million -- a 60 percent drop from last weekend, when the movie benefited from strong advance ticket sales. ''The Dark Knight Rises'' has now taken in about $289.1 million in the United States and Canada, or 14 percent less than its franchise predecessor grossed over the same period in 2008, after adjusting for inflation.",NA,"2012-07-30T00:00:00Z","article","News","501eea0b1c22dfde670b48f2",293,"'Dark Knight' Leads at Sluggish Box Office","ARTSBEAT",NA,NA,NA,NA,NA,NA
"42","https://www.nytimes.com/2012/08/07/nyregion/after-shootings-a-push-for-stricter-gun-laws-in-new-york.html","State lawmakers, prompted by violence in New York City and two recent mass shootings, are seeking to tighten legislation that is already among the country’s strictest....","State lawmakers, prompted by violence in New York City and two recent mass shootings, are seeking to tighten legislation that is already among the country’s strictest.","New York State lawmakers are planning a push to win approval of tighter state gun laws, prompted by recent violence in New York City and in the wake of mass shootings in Colorado and Wisconsin; one measure would require background checks for the purchase ammunition, while another would limit the purchase of firearms to one per person per month.","2012-08-07T00:00:00Z","article","News","53f9933238f0d84410bcb120",709,"After Shootings, Push in Albany for Tougher Gun Laws",NA,NA,NA,"After Shootings, a Push For Tougher Gun Laws",NA,"After Shootings, a Push for Stricter Gun Laws in New York",NA
"43","https://www.nytimes.com/2012/08/08/us/politics/polls-find-opposition-to-stricter-gun-laws.html","Some 4 in 10 voters in Colorado, Virginia and Wisconsin say that they do want gun laws to be toughened, new Quinnipiac University/New York Times/CBS News polls find....","Some 4 in 10 voters in Colorado, Virginia and Wisconsin say that they do want gun laws to be toughened, new Quinnipiac University/New York Times/CBS News polls find.","Quinnipiac University/New York Times/CBS News polls find roughly 4 in 10 voters in Colorado, Virginia and Wisconsin want gun laws to be toughened; about 6 in 10 voters in Virginia and Wisconsin and two-thirds in Colorado say stricter laws would not deter gunmen intent on mass shootings.","2012-08-08T00:00:00Z","article","News","53f99c0038f0d84410bcb17a",531,"Mixed Views Are Found on Stricter Laws for Guns",NA,NA,NA,"Mixed Views Are Found On Stricter Laws for Guns",NA,"Polls Find Opposition to Stricter Gun Laws",NA
"44","https://www.nytimes.com/2012/08/16/nyregion/professor-may-be-fired-for-joke-about-suspect-in-colorado-shootings.html","A professor at the United States Merchant Marine Academy was accused of “notoriously disgraceful conduct” after his remark upset a student whose father had been killed in the mass shooting in Colorado....","A professor at the United States Merchant Marine Academy was accused of “notoriously disgraceful conduct” after his remark upset a student whose father had been killed in the mass shooting in Colorado.","United States Merchant Marine Academy Professor Gregory F Sullivan faces firing after making a joke in his classroom about the mass killing in Aurora, Colo; a student who was present at the remark lost his father in the massacre, and school's academic dean says Sullivan should have been reasonably aware of that fact ; Sullivan has been suspended pending a hearing.","2012-08-16T00:00:00Z","article","News","515d9d25cf28d0219d0006ba",658,"Professor Faces Firing for Joke Tied to Shootings",NA,NA,NA,"Professor Faces Firing For Joke Tied To Shootings",NA,"Professor May Be Fired for Joke About Suspect in Colorado Shootings",NA
"45","https://www.nytimes.com/2012/08/17/us/colorado-mass-shooting-tested-an-er-staff.html","Workers at one of the Colorado emergency rooms where many victims of a mass shooting arrived look back with pride at their performance and horror at the event....","Workers at one of the Colorado emergency rooms where many victims of a mass shooting arrived look back with pride at their performance and horror at the event.","Members of the medical staff at the University of Colorado Hospital, one of the emergency rooms that treated victims of the Aurora shooting, look back with pride at their performance and horror at the event.","2012-08-17T00:00:00Z","article","News","53f9e4ba38f0d84410bcb4e8",1360,"The Night the E.R. Staff Can Never Forget",NA,NA,NA,"The Night the E.R. Staff Can Never Forget",NA,"Colorado Mass Shooting Tested an E.R. Staff",NA
"46","https://query.nytimes.com/gst/fullpage.html?res=9C07E3DC123AF931A1575BC0A9649D8B63","An  article  on Friday about the emergency room staff at the University of Colorado Hospital, which received 23 victims of the mass shooting at a movie theater, erroneously attributed a distinction to the Denver Health Medical Center, which also t...","An article on Friday about the emergency room staff at the University of Colorado Hospital, which received 23 victims of the mass shooting at a movie theater, erroneously attributed a distinction to the Denver Health Medical Center, which also treated victims. It is one of two Level 1 trauma centers in the area -- not the only one. (Swedish Medical Center also has such a facility.)",NA,"2012-08-22T00:00:00Z","article","Correction","503d35531c22dfde670b7ab5",66,"Corrections",NA,NA,NA,NA,NA,NA,NA
"47","https://www.nytimes.com/2012/08/24/nyregion/calls-for-stricter-gun-laws-worry-ilion-ny-built-by-remington.html","Two recent mass shootings have galvanized advocates of tougher gun laws in Albany, and Remington has made it clear that such laws could prompt it to leave New York for a more sympathetic state....","Two recent mass shootings have galvanized advocates of tougher gun laws in Albany, and Remington has made it clear that such laws could prompt it to leave New York for a more sympathetic state.","Residents of Ilion, NY, a community whose history and economy are indelibly linked to factory of celebrated American gunmaker Remington, are starting to worry about the future; multiple mass shootings have galvanized advocates of tougher gun laws in New York, and Remington has made it clear that such laws could prompt it to leave for a more sympathetic state.","2012-08-24T00:00:00Z","article","News","53fa2c5738f0d8431914d4b2",1258,"Call to Stiffen Laws Worries Town Built by Guns",NA,NA,NA,"Call to Stiffen Laws Worries Town Built by Guns",NA,"Calls for Stricter Gun Laws Worry Ilion, N.Y., Built by Remington",NA
"48","https://www.nytimes.com/video/us/100000001741110/gun-country.html","How do those who buy, sell and love guns come to terms with mass shootings? Meet the people at the Firing Line in Aurora, Colo....","How do those who buy, sell and love guns come to terms with mass shootings? Meet the people at the Firing Line in Aurora, Colo.",NA,"2012-08-26T22:10:10Z","multimedia","Video","504a79331c22dfde670bcfec",25,"Gun Country",NA,NA,NA,NA,NA,NA,"Coming to Terms With Mass Shootings"
"49","https://query.nytimes.com/gst/fullpage.html?res=9A04E6DC1F3EF930A2575AC0A9649D8B63","ALBANY - Following mass shootings this summer in Colorado and Wisconsin, a majority of voters in New York State favor more stringent laws restricting the purchase of guns, according to  a poll released Wednesday .   Sixty-one percent of voters sai...","ALBANY - Following mass shootings this summer in Colorado and Wisconsin, a majority of voters in New York State favor more stringent laws restricting the purchase of guns, according to a poll released Wednesday . Sixty-one percent of voters said they believed the state's laws pertaining to gun sales should be stricter, according to the poll, conducted by Quinnipiac University. And 68 percent of voters said they supported limiting handgun purchases to one per person per month.","Quinnipiac University poll shows that a majority of voters in New York State favor more stringent laws restricting the purchase of guns, with sixty-one percent of voters saying they believe the laws should be stricter and 68 percent supporting the limit of handgun purchases to one person per month. (M)","2012-09-13T00:00:00Z","article","News","505a3e001c22dfde670c9ad8",330,"Stiffer Gun Laws Popular in State, A Survey Finds","CITY ROOM",NA,NA,NA,NA,NA,NA
"50","https://www.nytimes.com/2012/09/23/education/guns-on-campus-at-university-of-colorado-causes-unease.html","Some faculty members warn of a climate of fear and intimidation if concealed weapons are permitted on the University of Colorado campus after a State Supreme Court ruling....","Some faculty members warn of a climate of fear and intimidation if concealed weapons are permitted on the University of Colorado campus after a State Supreme Court ruling.","Some University of Colorado faculty members warn of a climate of fear and intimidation if concealed weapons are permitted on campus after a State Supreme Court ruling; anxiety over the university's new policy has risen, driven in part by the July mass shooting at an Aurora movie theater; opposing views cite the right of self-defense versus the fear of violence.","2012-09-23T00:00:00Z","article","News","505df11c1c22dfde670ca572",1016,"University Is Uneasy as Court Ruling Allows Guns on Campus",NA,NA,NA,"University of Colorado Is Uneasy as Court Ruling Allows Guns on Campus",NA,"Guns on Campus at University of Colorado Causes Unease",NA
"51","https://www.nytimes.com/2012/10/20/opinion/collins-the-least-popular-campaign-subject-gun-control.html","People, have you noticed how gun control rarely comes up in the presidential race? Let’s thank Nina Gonzalez for bringing it up....","People, have you noticed how gun control rarely comes up in the presidential race? Let’s thank Nina Gonzalez for bringing it up.","Gail Collins Op-Ed column praises Nina Gonzalez, woman who asked Mitt Romney and Pres Obama about their stance on gun control during second presidential debate; says issue has gone unaddressed for far too long considering there have been 43 American  mass shootings in the last year.","2012-10-20T00:00:00Z","article","Op-Ed","5087264c95e998af7118797b",818,"The Least Popular Subject","Op-Ed Columnist",NA,"Op-Ed Columnist","The Least Popular Subject",NA,"The Least Popular Campaign Subject (Gun Control!)",NA
"52","https://www.nytimes.com/2012/12/15/opinion/blow-a-tragedy-of-silence.html","When will our elected officials and lawmakers finally confront the gun lobby?...","When will our elected officials and lawmakers finally confront the gun lobby?","Charles M Blow Op-Ed column asks whether more mass shootings will be necessary before lawmakers confront need for stricter gun laws; says gun lobby has grown ever more powerful and assertive, even in year marked by large number of shootings like the one in Newtown, Conn.","2012-12-15T00:00:00Z","article","Op-Ed","50cbeae200315214fbb7f7fc",790,"A Tragedy of Silence","Op-Ed Columnist",NA,"Op-Ed Columnist","A Tragedy of Silence",NA,"A Tragedy of Silence",NA
"53","https://www.nytimes.com/2012/12/15/us/politics/obamas-reaction-to-connecticut-shooting-sets-stage-for-gun-debate.html","In the wake of the deadly shooting in Connecticut, some legislators have remained silent, but liberal Democrats said it was time to move forward with serious gun laws....","In the wake of the deadly shooting in Connecticut, some legislators have remained silent, but liberal Democrats said it was time to move forward with serious gun laws.","Pres Obama, during emotional address on the mass shooting in Newtown, Conn, pledges to take 'meaningful action' to prevent similar tragedies from occurring in the future; cautious statement is immediately criticized for being too timid, but also signals that the country's long-dormant debate over gun laws will likely be re-engaged.","2012-12-15T00:00:00Z","article","News","50cbe6a800315214fbb7f7ee",1058,"Obama’s Cautious Call for Action Sets Stage to Revive Gun Debate",NA,NA,NA,"Obama’s Cautious Call for Action Sets Stage to Revive Gun Debate",NA,"Obama’s Reaction to Connecticut Shooting Sets Stage for Gun Debate",NA
"54","https://www.nytimes.com/2012/12/15/nyregion/adam-lanza-an-enigma-who-is-now-identified-as-a-mass-killer.html","Former classmates and acquaintances of Adam Lanza described him as an awkward loner who was deeply uncomfortable in social situations....","Former classmates and acquaintances of Adam Lanza described him as an awkward loner who was deeply uncomfortable in social situations.","Adam Lanza, gunman who carried out one of the deadliest school shootings in the nation’s history, killing 20 children and six adults at Sandy Hook Elementary School in Newtown, Conn, is described by former classmates and acquaintances of as an awkward loner who was deeply uncomfortable in social situations; history of mass shootings in US charted.","2012-12-15T00:00:00Z","article","News","50cbdca100315214fbb7f7d5",1013,"A Gunman, Recalled as Intelligent and Shy, Who Left Few Footprints in Life",NA,NA,NA,"A Gunman, Recalled as Intelligent and Shy, Who Left Few Footprints in Life",NA,"Adam Lanza, an Enigma Who Is Now Identified as a Mass Killer",NA
"55","https://www.nytimes.com/2012/12/15/nyregion/sandy-hook-principal-and-school-psychologist-went-the-extra-mile.html","Among the victims, Dawn Hochsprung, the Sandy Hook Elementary School principal, and Mary Sherlach, a psychologist there, were dedicated to their students, colleagues and parents said....","Among the victims, Dawn Hochsprung, the Sandy Hook Elementary School principal, and Mary Sherlach, a psychologist there, were dedicated to their students, colleagues and parents said.","Dawn Hochsprung, the Sandy Hook Elementary School principal, and Mary Sherlach, school psychologist there, are among  the six adults killed in the mass shooting at the Sandy Hook Elementary school in Newtown, Conn.","2012-12-15T00:00:00Z","article","News","50cbda0900315214fbb7f7cd",840,"Two Educators Went the Extra Mile for Students",NA,NA,NA,"Two Educators Are Recalled as Going the Extra Mile for Students",NA,"Two Newtown Educators Went the Extra Mile for Students",NA
"56","https://www.nytimes.com/2012/12/15/nyregion/sandy-hook-shooting-forces-re-examination-of-tough-questions.html","After the second deadliest mass shooting in the country’s history, Americans find themselves debating access to guns, security practices and mental health issues....","After the second deadliest mass shooting in the country’s history, Americans find themselves debating access to guns, security practices and mental health issues.","Newtown, Conn, joins places like Littleton, Colo, and Jonesboro, Ark, where schools became the scenes of stunning violence; gun control, school security and mental health issues become once again a focus of the nation details emerge from the massacre at Sandy Hook Elementary School.","2012-12-15T00:00:00Z","article","News","50cbd0a400315214fbb7f7af",841,"Nation’s Pain Is Renewed, and Difficult Questions Are Asked Once More",NA,NA,NA,"Nation’s Pain Is Renewed, and Difficult Questions Are Asked Once More",NA,"Sandy Hook Forces Re-examination of Tough Questions",NA
"57","https://www.nytimes.com/2012/12/15/health/tips-for-talking-to-children-about-the-elementary-school-mass-shooting.html","Therapists who treat childhood trauma said on Friday that parents talking to their children about the mass shooting should address the news directly and soon....","Therapists who treat childhood trauma said on Friday that parents talking to their children about the mass shooting should address the news directly and soon.",NA,"2012-12-15T00:00:00Z","article","News","53fe1aae38f0d86da18a0462",540,"Tips for Talking to Children About the Shooting",NA,NA,NA,NA,NA,"Tips for Talking to Children About the Elementary School Mass Shooting",NA
"58","https://www.nytimes.com/2012/12/16/us/politics/connecticut-shooting-revives-gun-control-debate.html","As the country absorbs yet another mass shooting, both supporters and opponents of stricter gun laws are asking whether the carnage might change a trajectory toward fewer restrictions....","As the country absorbs yet another mass shooting, both supporters and opponents of stricter gun laws are asking whether the carnage might change a trajectory toward fewer restrictions.","Supporters and opponents of stricter gun laws, all stunned by Newtown, Conn, massacre, are beginning to ask whether carnage might change nation's general trajectory toward less gun control; some gun control advocates say they hope shooting will be catalyst for change toward greater restrictions on firearms.","2012-12-16T00:00:00Z","article","News","50ccec9200315214fbb7f94c",1035,"Debate on Gun Control Is Revived, Amid a Trend Toward Fewer Restrictions",NA,NA,NA,"Debate on Gun Control Is Revived, Amid a Trend Toward Fewer Restrictions",NA,"Connecticut Shooting Revives Gun Control Debate",NA
"59","https://www.nytimes.com/2012/12/16/nyregion/for-newtown-horror-halts-a-season-of-celebration.html","People in Newtown, where the holidays push back against the dominance of the long winter night, struggled with whether, and how, to go on with something that seemed like normal life....","People in Newtown, where the holidays push back against the dominance of the long winter night, struggled with whether, and how, to go on with something that seemed like normal life.","Newtown, Conn, residents struggle after horrific mass shootings, with a season of celebration halted and no instruction book on how to handle their own raw feelings as grief engulfs holiday joy.","2012-12-16T00:00:00Z","article","News","50ccbb0b00315214fbb7f8f7",1031,"In a Town of Traditions, Grief Engulfs Holiday Joy",NA,NA,NA,"In a Town of Traditions, Grief Engulfs Holiday Joy",NA,"For Close-Knit Town, Horror Halts a Season of Celebration",NA
"60","https://thecaucus.blogs.nytimes.com/2012/12/17/in-recent-years-a-drop-in-public-support-for-gun-control-laws/","Support for gun control measures has steadily dropped over the last decade, and previous mass shootings had little effect on public opinion about gun laws....",NA,"Support for gun control measures has steadily dropped over the last decade, and previous mass shootings had little effect on public opinion about gun laws.","2012-12-17T14:03:27Z","blogpost","Blog","50d0e5ab00315214fbb7fd6a",744,"In Recent Years, a Drop in Public Support for Gun Control Laws","The Caucus",NA,NA,NA,NA,NA,NA
"61","https://www.nytimes.com/2012/12/17/us/lanza-used-a-popular-ar-15-style-rifle-in-newtown.html","Adam Lanza used a Bushmaster semiautomatic rifle, a model of the popular AR-15 style guns that can fire multiple rounds rapidly and at high velocity and have appeared in other recent shooting rampages....","Adam Lanza used a Bushmaster semiautomatic rifle, a model of the popular AR-15 style guns that can fire multiple rounds rapidly and at high velocity and have appeared in other recent shooting rampages.","Adam Lanza, gunman in the Newtown, Conn, school massacre, used a Bushmaster semiautomatic rifle, popular AR-15 style gun that can fire multiple rounds rapidly and at high velocity; AR-15 guns have appeared in other recent mass shootings around the country, and Newtown shooting has rekindled debate on the gun's availability and its appeal to killers bent on slaughter.","2012-12-17T00:00:00Z","article","News","50d0e48600315214fbb7fa6d",1322,"Rifle Used in Killings, America’s Most Popular, Highlights Regulation Debate",NA,NA,NA,"Rifle Used in Killings, America’s Most Popular, Highlights Regulation Debate",NA,"Newtown Shooter Used a Rifle Popular Among Gun Owners",NA
"62","https://thelede.blogs.nytimes.com/2012/12/19/updates-on-connecticut-shooting-aftermath/","Live updates from Connecticut and around the world in the aftermath of the second deadliest mass shooting in the United States....",NA,"Live updates from Connecticut and around the world in the aftermath of the second deadliest mass shooting in the United States.","2012-12-19T10:54:12Z","blogpost","Blog","50d1fa3f00315214fbb80368",3163,"Dec. 19 Updates on Connecticut Shooting Aftermath","The Lede",NA,NA,NA,NA,NA,NA
"63","https://thecaucus.blogs.nytimes.com/2012/12/19/biden-to-lead-administration-effort-to-develop-response-to-shootings/","President Obama has ordered Vice President Joseph R. Biden Jr. to lead an interagency group to develop a multifaceted response to last week's mass shooting at a Connecticut school, a White House official said....",NA,"President Obama has ordered Vice President Joseph R. Biden Jr. to lead an interagency group to develop a multifaceted response to last week's mass shooting at a Connecticut school, a White House official said.","2012-12-19T06:00:20Z","blogpost","Blog","50d1fa3b00315214fbb80358",478,"Biden to Lead Administration Effort to Develop Response to Shootings","The Caucus",NA,NA,NA,NA,NA,NA
"64","https://www.nytimes.com/2012/12/19/us/states-leaders-proposing-steps-to-control-guns.html","The first concrete responses to the shootings in Newtown, Conn., began emerging Tuesday, as state leaders, corporations and the White House pointed to gun control measures....","The first concrete responses to the shootings in Newtown, Conn., began emerging Tuesday, as state leaders, corporations and the White House pointed to gun control measures.","First concrete responses to the massacre in Newtown, Conn, begin emerging as state leaders propose measures to curb gun violence, corporations distance themselves from the event and the Obama administration highlights its plans to champion gun control; reactions are far more broad-based than those following previous mass shootings, leading gun control proponents to be cautiously optimistic that concrete and lasting legislation might be enacted.","2012-12-19T00:00:00Z","article","News","50d1f9e600315214fbb80261",1396,"Broad Gun Control Efforts Introduced in Wake of Shooting",NA,NA,NA,"States’ Leaders Proposing Steps To Control Guns",NA,"States’ Leaders Proposing Steps to Control Guns",NA
"65","https://www.nytimes.com/2012/12/19/us/politics/president-obama-facing-critical-choice-after-newtown-shooting.html","Hurricane Sandy, last month’s Latino turnout for Democrats and now the Newtown, Conn., shootings have presented President Obama with many decisions — and openings to make new arguments....","Hurricane Sandy, last month’s Latino turnout for Democrats and now the Newtown, Conn., shootings have presented President Obama with many decisions — and openings to make new arguments.","White House Memo; Pres Obama must decide whether to wage battles in his second term on issues that he cares about but may not win without a major shift in the dynamics of Washington; events like Hurricane Sandy, high Latino turnout for Democrats in November election and the mass shooting in Newtown, Conn, give him the opportunity to make fresh arguments for legislation on gun control, climate change and immigration.","2012-12-19T00:00:00Z","article","News","50d1f9e600315214fbb80262",1169,"Obama Facing Critical Choice After Shooting","White House Memo",NA,"White House Memo","Obama Facing Critical Choice After Shooting",NA,"President Obama Facing Critical Choice After Newtown Shooting",NA
"66","https://www.nytimes.com/2012/12/19/opinion/the-yawning-loophole-in-the-gun-laws.html","To strengthen the country’s porous gun laws, Congress must subject all buyers to background checks....","To strengthen the country’s porous gun laws, Congress must subject all buyers to background checks.","Editorial welcomes fact that lawmakers, in wake of mass shooting in Newtown, Conn,  seem to be moving toward requiring background checks for all gun sales; states measure would be most effective toward goal of keeping guns out of hands of those who cannot be trusted with them.","2012-12-19T00:00:00Z","article","Editorial","50d1f9b500315214fbb8020f",708,"The Yawning Loophole in the Gun Laws","Editorial | The Gun Challenge",NA,"Editorial","The Yawning Loophole in the Gun Laws",NA,"The Yawning Loophole in the Gun Laws",NA
"67","https://thelede.blogs.nytimes.com/2012/12/20/updates-on-connecticut-shooting-aftermath-2/","Live updates from Connecticut and around the world in the aftermath of the second deadliest mass shooting in the United States....",NA,"Live updates from Connecticut and around the world in the aftermath of the second deadliest mass shooting in the United States.","2012-12-20T09:58:50Z","blogpost","Blog","50d32bca00315214fbb80733",4134,"Dec. 20 Updates on Connecticut Shooting Aftermath ","The Lede",NA,NA,NA,NA,NA,NA
